An Intelligent Smart healthcare system for patient monitoring based on CNN machine learning algorithm,V. Parameshwari; S. Kavitha,"Electronics and Communication Engineering, Nandha Engineering College, Erode, Tamilnadu, India; Electronics and Communication Engineering, Nandha Engineering College, Erode, Tamilnadu, India",2024 2nd International Conference on Artificial Intelligence and Machine Learning Applications Theme: Healthcare and Internet of Things (AIMLA),21-May-24,2024,,,1,7,"Diseases are spreading swiftly among people in the modern society, and it is challenging to diagnose illnesses in older people with diabetes, heart disease, kidney disease, and other health challenges. They affect the neurological system and result in vision loss in addition to the diseases indicated above. The proposed method provides a machine learning technique that uses convolution neural network (CNN) classifiers to detect diseases for patients earlier, offering an advantage over linear regression, KNN and decision tree approaches. This algorithm has good accuracy, precision, and recall compare to KNN, Linear regression, Decision tree methods. The recommended system is a trustworthy health monitoring system with sufficient intelligence to leverage the IoT to keep an eye on the patient without human intervention. By using these technologies, it gathers significance information about the patient, including blood pressure, temperature, heart rate, and ECG and uses that information to send an emergency warning via an Android phone to the patient’s physician and patients relative, along with the patient’s present situation. The proposed system allows the consultant as well as caregiver to observe their patient from wherever in the globe. Smart sensors are used by this proposed system to generate real time data that is to be gathered from various sensors and is to be sent to a cloud for analysis and statistical safeguarding before being used. In the recommended patient monitoring system approach, the parameters pertaining to the patient’s health are tracked health metrics with a Raspberry Pi. The Raspberry Pi act as server and sends data to the website then the consultant and caregivers can use laptops, tablets, and smart phones to check a patient’s health issues where ever by using their IP address. Doctors and family members will receive an automatic SMS alert if any of these parameters deviate from normal. This study makes use of a Raspberry Pi Board as an Internet of Things gadget to read patient health parameters and interface with different sensors. These health metrics are then sent to the cloud. The caregiver and doctor have cloud access to these values. If the doctor is unable to visit the patient in the hospital, the proposed system will be a helpful tool for quickly giving prescriptions and keeping an eye on the health of the patient from a distance.",,979-8-3503-4922-1,10.1109/AIMLA59606.2024.10531600,,https://ieeexplore.ieee.org/stamp/stamp.jsp?arnumber=10531600,Internet of Things (IoT);Machine learning algorithm;CNN;linear regression;Raspberry Pi,Support vector machines;Cloud computing;Patient monitoring;Machine learning algorithms;Medical services;Machine learning;Real-time systems,,7,,20,IEEE,21-May-24,15-16 March 2024,15-16 March 2024,IEEE,IEEE Conferences
Hybrid Deep Learning model based Smart Monitoring System for Covid-19 Patients,G. Puthilibai; D. V; G. V; E. Mohan; V. Hariram; N. K. R,"Department of Chemistry, Sri Sairam Engineering College, Chennai, Tamil Nadu, India; Bachelor of Surgery, Sri Muthukumaran Medical College, Hospital and Research Institute, Chennai, Tamil Nadu, India; Bachelor of Surgery, Sri Muthukumaran Medical College, Hospital and Research Institute, Chennai, Tamil Nadu, India; Department of Electronics and Communication Engineering, Saveetha School of Engineering, SIMATS, Chennai, Tamil Nadu, India; Department of Practice of Medicine, Vinayaka Mission's Homoeopathic Medical College and Hospital, Vinayaka Missions Research Foundation Deemed to be University, Salem, Tamil Nadu, India; Department of Artificial Intelligence and Data Science, Sri Sairam Engineering College, Chennai, Tamil Nadu, India","2024 International Conference on Power, Energy, Control and Transmission Systems (ICPECTS)",12-Dec-24,2024,,,1,5,"The COVID-19-patient health tracking system is a risk factormajor public health challenge for COVID-19 patients, and it has inherited an ample supply of mindfuless recently from the medical community because of the ageing population and an increase in chronic illnesses. It is challenging for traditional wireless communication technology to fully meet the real-time requirements for wearable medical devices. Current monitoring framework cannot handle the massive amount of synchronous cardiovascular data due to the lack of effective streaming data processing mechanisms. The suggested paper uses Internet of Things (IoT) technology to obtain patient medical data both locally and remotely. The patient's temperature sensor and pulse sensor send data to a cloud server, which analyses it with the unification of Hybrid deep-learning model combining a convolutional neural network (CNN) and long short-term memory (LSTM) is utilized and manages it for later analysis. According to the experimental findings, the accuracy of our proposed system was 99.4, sensitivity 99.3%, specificity 99.2% and F1-score is 98.9% respectively.",,979-8-3315-0884-5,10.1109/ICPECTS62210.2024.10780093,,https://ieeexplore.ieee.org/stamp/stamp.jsp?arnumber=10780093,Deep learning;wearable devices;Internet of Things;Convolutional neural network;Long short-term memory;Covid-19,COVID-19;Wireless communication;Temperature sensors;Sensitivity;Real-time systems;Internet of Things;Convolutional neural networks;Servers;Monitoring;Long short term memory,,1,,23,IEEE,12-Dec-24,8-9 Oct. 2024,8-9 Oct. 2024,IEEE,IEEE Conferences
Transformative Role of IoT and AI in Health Monitoring Systems: A Systematic Mapping Review,H. Djeddi; A. Saighi; M. Derdour; A. Merabet,"LIAOA Laboratory, University of Oum El Bouaghi, Oum El Bouaghi, Algeria; LIAOA Laboratory, University of Oum El Bouaghi, Oum El Bouaghi, Algeria; LIAOA Laboratory, University of Oum El Bouaghi, Oum El Bouaghi, Algeria; LIAOA Laboratory, University of Oum El Bouaghi, Oum El Bouaghi, Algeria","2024 1st International Conference on Electrical, Computer, Telecommunication and Energy Technologies (ECTE-Tech)",28-Jan-25,2024,,,1,8,"This systematic mapping review aims to analyze the impact of Artificial Intelligence (AI) and the Internet of Things (IoT) on health surveillance systems, both in hospitals and for remote patient monitoring. We conducted a comprehensive search across multiple databases, identifying a range of surveillance systems that utilize these technologies. This mapping highlights the key contributions of significant research works, categorizing them by type and application area. Furthermore, we discuss the challenges associated with data security and system integration, identifying critical gaps in the literature. The findings underscore the necessity for effective and secure implementations of AI and IoT in healthcare settings to enhance monitoring capabilities and optimize patient outcomes.",,979-8-3503-8848-0,10.1109/ECTE-Tech62477.2024.10851144,,https://ieeexplore.ieee.org/stamp/stamp.jsp?arnumber=10851144,Monitoring systems;Artificial intelligence;IOT;Healthcare,Patient monitoring;Systematics;Reviews;Hospitals;Databases;Surveillance;Data security;System integration;Internet of Things;Artificial intelligence,,,,32,IEEE,28-Jan-25,17-18 Dec. 2024,17-18 Dec. 2024,IEEE,IEEE Conferences
Development of IoT Based Smart System and Data Acquisition for Patient Monitoring,M. Shakir; A. Arshad; M. O. Tariq; U. Sadiq; U. Shabbir,"Department of Electrical Engineering, The Superior University, Lahore; Department of Electrical Engineering, The Superior University, Lahore; Department of Electrical Engineering, The Superior University, Lahore; Department of Electrical Engineering, The Superior University, Lahore; Department of Electrical Engineering, The Superior University, Lahore",2024 International Conference on Engineering and Emerging Technologies (ICEET),12-Mar-25,2024,,,1,6,"In today's busy lifestyle of people it is difficult to maintain health and keep track of patient's health related issues. This problem gets further difficult due to low doctors to patients' ratio in the under-developed countries. However, the advancement in the field of ICT has brought smartness to the medical field. The Internet of Things is rapidly transforming medical technology and famously known as Internet of Medical Things (IoMT). Therefore, in this research work an IoT based smart and cost-effective patient monitoring system has been developed. The vital signs of the patient such as temperature, heart rate, and oxygen level have been measured through sensors and provided at the ESP-32, an internet enabled microcontroller. The acquired data will be transmitted through internet to the gateway and a dashboard is designed using the MQTT protocol for its visualization purpose.",2831-3682,979-8-3315-3289-5,10.1109/ICEET65156.2024.10913614,,https://ieeexplore.ieee.org/stamp/stamp.jsp?arnumber=10913614,ESP32;IoT;IoMT;MQTT;Patient Monitoring System,Temperature sensors;Temperature measurement;Heart rate;Patient monitoring;Protocols;Microcontrollers;Internet of Medical Things;Logic gates;Smart systems;Intelligent sensors,,2,,25,IEEE,12-Mar-25,27-28 Dec. 2024,27-28 Dec. 2024,IEEE,IEEE Conferences
Intelligent Medication System Based on Internet of Things,A. Chu,"The University of Manchester, Manchester, UK","2024 IEEE 3rd International Conference on Electrical Engineering, Big Data and Algorithms (EEBDA)",8-Apr-24,2024,,,254,258,"Nowadays, many common diseases are managed through the use of prolonged medication, and even many newborns rely on medicine to sustain their lives from the moment of birth. Currently, there are many smart medicine boxes, smart medicine kits and other devices for patients in the market. However, the prescription operation for individual patients lacks more personalized medication reminders, which is not conducive to improving the level of pharmaceutical services in the hospital. In order to remind patients to take medicine on time and monitor the physical condition of users after taking medicine, in this paper, we take the intelligent medication system of the Internet of Things and its working method as the research subject, and propose a novel medication reminder system of doctor-patient interconnection. The system includes a medicine box, a hospital system platform, and a smart bracelet for the user to wear. It can remind the user to take medicine when needed and monitor their physical condition after medication. Meanwhile, the hospital system platform accurately receives information, such as medication time, dosage and other details, and provides timely feedback and assistance to patients.",,979-8-3503-8098-9,10.1109/EEBDA60612.2024.10486006,,https://ieeexplore.ieee.org/stamp/stamp.jsp?arnumber=10486006,personalized medication reminders;intelligent medication system;Internet of Things;doctor-patient interconnection,Electrical engineering;Pediatrics;Hospitals;Big Data;Internet of Things;Biomedical monitoring;Monitoring,,2,,15,IEEE,8-Apr-24,27-29 Feb. 2024,27-29 Feb. 2024,IEEE,IEEE Conferences
Next-Generation Health Monitoring Using IoT,V. S; D. R; A. S; G. M; H. S,"Department of Electronics and Communication Engineering, M. Kumarasamy College of Engineering, Karur, Tamilnadu, India; Department of Electronics and Communication Engineering, M. Kumarasamy College of Engineering, Karur, Tamilnadu, India; Department of Electronics and Communication Engineering, M. Kumarasamy College of Engineering, Karur, Tamilnadu, India; Department of Electronics and Communication Engineering, M. Kumarasamy College of Engineering, Karur, Tamilnadu, India; Department of Electronics and Communication Engineering, M. Kumarasamy College of Engineering, Karur, Tamilnadu, India",2024 2nd International Conference on Artificial Intelligence and Machine Learning Applications Theme: Healthcare and Internet of Things (AIMLA),21-May-24,2024,,,1,5,"An Internet of Things-based health monitoring device transforms patient treatment by effortlessly tracking important signs such as blood oxygen levels, heart rate, and temperature in real-time. It also includes positioning monitoring to guarantee patient security. This extensive data is gathered and sent to a centralized platform using IoT devices, providing healthcare providers with instant access to vital information. Concurrently, a summary of the patient's health state is presented on an LCD screen, making it simple and quick for caretakers and medical professionals to understand. Proactive healthcare management is improved by this integrated approach, which promotes prompt interventions and individualized care for better patient outcomes.",,979-8-3503-4922-1,10.1109/AIMLA59606.2024.10531463,,https://ieeexplore.ieee.org/stamp/stamp.jsp?arnumber=10531463,LCD screen;Internet of Things (IoT);Health Management;Biometric sensors,Medical treatment;Transforms;Machine learning;Liquid crystal displays;Real-time systems;Internet of Things;Security,,3,,20,IEEE,21-May-24,15-16 March 2024,15-16 March 2024,IEEE,IEEE Conferences
Internet of Things Empowerment: Enhancing Healthcare Access for Deaf Patients,Z. H. Negash; T. Minh Duong; B. Abrhame; S. Kwon,"Dept. of Electrical, Electronic and Computer Engineering, University of Ulsan, Ulsan, South Korea; Dept. of Electrical, Electronic and Computer Engineering, University of Ulsan, Ulsan, South Korea; Center of Biomedical Engineering, Addis Ababa University, Addis Ababa, Ethiopia; Dept. of Electrical, Electronic and Computer Engineering, University of Ulsan, Ulsan, South Korea",2024 International Conference on Information Networking (ICOIN),3-Jul-24,2024,,,53,56,"This paper designs an Internet of Things(IoT) based support system to empower deaf patients by enhancing communication with healthcare providers and family members through wireless communication. Hearing-impaired individuals, especially deaf patients, face communication barriers that prevent them from seeking efficient healthcare services, such as timely medication adherence and seeking assistance from healthcare providers and family members. To address these challenges for deaf patients, the proposed system provides alerts, enables patients to confirm medication adherence, monitors vital signs, shares real-time data updates on a hospital portal, and sends direct text notifications in case of emergencies. The device is trained using specific command phrases and has achieved an average accuracy of 98% during various data trials.",1976-7684,979-8-3503-3094-6,10.1109/ICOIN59985.2024.10572148,National Research Foundation; Ministry of Education; ,https://ieeexplore.ieee.org/stamp/stamp.jsp?arnumber=10572148,Internet of Things (IoT);MERN;sign language;vital signs,Wireless communication;Accuracy;Hospitals;Assistive technologies;Real-time systems;Internet of Things;Biomedical monitoring,,,,9,IEEE,3-Jul-24,17-19 Jan. 2024,17-19 Jan. 2024,IEEE,IEEE Conferences
